{"appearances":[{"appearance_id":"neutral","kind":"PHYSICALLY_BASED_LIGHTING","paired_across_variants":true},{"appearance_id":"low_key","kind":"PHYSICALLY_BASED_LIGHTING","paired_across_variants":true},{"appearance_id":"high_key","kind":"PHYSICALLY_BASED_LIGHTING","paired_across_variants":true},{"appearance_id":"cool_sensor","kind":"PHYSICALLY_BASED_LIGHTING_AND_SENSOR","paired_across_variants":true}],"base_scenes":[{"camera_pose_jitter_mm":[6.0,6.0,3.0],"camera_rotation_jitter_deg":[1.5,1.5,2.0],"fixture_surface_randomization":"BOUNDED_PHYSICALLY_BASED","fresh_render_required":true,"isaac_seed":19030,"scene_id":"residual_training_scene_01","source_image_reuse_prohibited":true,"split":"training"},{"camera_pose_jitter_mm":[6.0,6.0,3.0],"camera_rotation_jitter_deg":[1.5,1.5,2.0],"fixture_surface_randomization":"BOUNDED_PHYSICALLY_BASED","fresh_render_required":true,"isaac_seed":19031,"scene_id":"residual_training_scene_02","source_image_reuse_prohibited":true,"split":"training"},{"camera_pose_jitter_mm":[6.0,6.0,3.0],"camera_rotation_jitter_deg":[1.5,1.5,2.0],"fixture_surface_randomization":"BOUNDED_PHYSICALLY_BASED","fresh_render_required":true,"isaac_seed":19032,"scene_id":"residual_training_scene_03","source_image_reuse_prohibited":true,"split":"training"},{"camera_pose_jitter_mm":[6.0,6.0,3.0],"camera_rotation_jitter_deg":[1.5,1.5,2.0],"fixture_surface_randomization":"BOUNDED_PHYSICALLY_BASED","fresh_render_required":true,"isaac_seed":19033,"scene_id":"residual_training_scene_04","source_image_reuse_prohibited":true,"split":"training"},{"camera_pose_jitter_mm":[6.0,6.0,3.0],"camera_rotation_jitter_deg":[1.5,1.5,2.0],"fixture_surface_randomization":"BOUNDED_PHYSICALLY_BASED","fresh_render_required":true,"isaac_seed":19034,"scene_id":"residual_training_scene_05","source_image_reuse_prohibited":true,"split":"training"},{"camera_pose_jitter_mm":[6.0,6.0,3.0],"camera_rotation_jitter_deg":[1.5,1.5,2.0],"fixture_surface_randomization":"BOUNDED_PHYSICALLY_BASED","fresh_render_required":true,"isaac_seed":19035,"scene_id":"residual_training_scene_06","source_image_reuse_prohibited":true,"split":"training"},{"camera_pose_jitter_mm":[6.0,6.0,3.0],"camera_rotation_jitter_deg":[1.5,1.5,2.0],"fixture_surface_randomization":"BOUNDED_PHYSICALLY_BASED","fresh_render_required":true,"isaac_seed":19036,"scene_id":"residual_training_scene_07","source_image_reuse_prohibited":true,"split":"training"},{"camera_pose_jitter_mm":[6.0,6.0,3.0],"camera_rotation_jitter_deg":[1.5,1.5,2.0],"fixture_surface_randomization":"BOUNDED_PHYSICALLY_BASED","fresh_render_required":true,"isaac_seed":19037,"scene_id":"residual_training_scene_08","source_image_reuse_prohibited":true,"split":"training"},{"camera_pose_jitter_mm":[6.0,6.0,3.0],"camera_rotation_jitter_deg":[1.5,1.5,2.0],"fixture_surface_randomization":"BOUNDED_PHYSICALLY_BASED","fresh_render_required":true,"isaac_seed":19130,"scene_id":"residual_development_scene_01","source_image_reuse_prohibited":true,"split":"development"},{"camera_pose_jitter_mm":[6.0,6.0,3.0],"camera_rotation_jitter_deg":[1.5,1.5,2.0],"fixture_surface_randomization":"BOUNDED_PHYSICALLY_BASED","fresh_render_required":true,"isaac_seed":19131,"scene_id":"residual_development_scene_02","source_image_reuse_prohibited":true,"split":"development"},{"camera_pose_jitter_mm":[6.0,6.0,3.0],"camera_rotation_jitter_deg":[1.5,1.5,2.0],"fixture_surface_randomization":"BOUNDED_PHYSICALLY_BASED","fresh_render_required":true,"isaac_seed":19132,"scene_id":"residual_development_scene_03","source_image_reuse_prohibited":true,"split":"development"},{"camera_pose_jitter_mm":[6.0,6.0,3.0],"camera_rotation_jitter_deg":[1.5,1.5,2.0],"fixture_surface_randomization":"BOUNDED_PHYSICALLY_BASED","fresh_render_required":true,"isaac_seed":19133,"scene_id":"residual_development_scene_04","source_image_reuse_prohibited":true,"split":"development"}],"bundle_sha256":"7e861cb17b5f4717d732989d1ddaaeb4ab3e3e4e0ae1d92dd19de35afa397fed","development_gate":{"base_scene_cluster_bootstrap_resamples":4000,"base_scene_cluster_bootstrap_seed":19030,"confidence_level":0.95,"evaluation_must_remain_unopened":true,"every_target_margin_must_be_strictly_positive":true,"minimum_target_local_separation_margin":0.0,"missed_obstruction_rate_upper":0.02,"point_and_cluster_upper_bounds_must_pass":true,"visible_false_stop_rate_upper":0.06,"worst_appearance_must_pass":true,"worst_variant_family_must_pass":true},"hardware_writes":0,"images_generated":false,"limitations":["This fixture predeclares synthetic Isaac work and is not physical or deployment qualification","The camera, materials, and obstruction meshes remain unmeasured until physical originals exist","The consumed v2 development diagnosis may motivate this design but cannot evaluate or select v3","No evaluation source, controller command, motion policy, permit, transport, or physical authority is included"],"physical_authority":false,"physical_movements":0,"render_admission":{"depth_prohibited_as_model_input":true,"depth_retained_for_admission_only":true,"fail_on_duplicate_observation_bytes":true,"fresh_full_frame_required_per_base_scene":true,"mesh_geometry_required_for_physical_obstructions":true,"physically_based_material_required":true,"renderer":"ISAAC_SIM_3D","rgb_is_only_model_input":true,"safe_region_overlap_must_match_declared_range":true,"source_image_warp_prohibited":true,"truth_masks_prohibited_as_model_input":true,"truth_masks_retained_for_labels_only":true},"schema":"tactevra.ai_residual_obstruction_successor_fixture.v3","scope":"SYNTHETIC_ISAAC_PREDECLARATION_NO_QUALIFICATION","source":{"diagnostic_file_sha256":"9560c6bd6c2d0463741e2f0e8221d16d520f062b7fdfd525f79272a7374cbfb6","diagnostic_report_sha256":"48496f1015b31c859bdf4ca2e53a8b4b50ef59ad524f35ea74e5caf864fe8517","practice_corpus_sha256":"03e2d3d7ac2d3a0026b2c24cb0a9d709190794e1adb5b69e038374fa46f152e4","practice_manifest_file_sha256":"a529ffbdc39aff5450d0378f2e3020c83b398a3e7f853b0ef4e957748e34c7fd","rejected_model_sha256":"0f5982b6af2761ce367837c35094647cfa5711f1fd042ede36650ba9306a1367","target_catalog_sha256":"6779213e832ab27eeda1e7fb245f57ff8cb0d56707b5aa73a8f31ec483a620f2"},"split_policy":{"base_scene_ids_disjoint":true,"development_observation_count":14400,"evaluation_group_present":false,"evaluation_observation_count":0,"minimum_independent_development_scenes":4,"minimum_independent_training_scenes":8,"training_observation_count":28800},"training_plan":{"algorithm":"target_crop_residual_cnn_v3","batch_size":128,"convolution_channels":[24,48,64],"epochs":24,"input_channels":["RGB"],"input_size_px":[96,96],"learning_rate":0.0003,"losses":{"appearance_consistency":"PAIRED_LOGIT_HUBER","appearance_consistency_weight":0.2,"classification":"BINARY_CROSS_ENTROPY"},"normalization":"GROUP_NORM","optimizer":"ADAMW","sampling":"TARGET_LABEL_VARIANT_AND_BASE_SCENE_BALANCED","seed":19030,"threshold_candidates":[0.05,0.1,0.15,0.2,0.25,0.3,0.35,0.4,0.45,0.5,0.55,0.6,0.65,0.7,0.75,0.8,0.85,0.9,0.95],"weight_decay":0.0001},"training_started":false,"variants":[{"decision":"VISIBLE","family":"NONE","geometry":{"kind":"NONE"},"variant_id":"clear"},{"decision":"VISIBLE","family":"DISTRACTOR","geometry":{"kind":"MESH_DISTRACTOR","safe_overlap":0.0,"side":"LEFT"},"variant_id":"adjacent_left"},{"decision":"VISIBLE","family":"DISTRACTOR","geometry":{"kind":"MESH_DISTRACTOR","safe_overlap":0.0,"side":"RIGHT"},"variant_id":"adjacent_right"},{"decision":"ABSTAIN","family":"CABLE","geometry":{"depth_offset_mm":[-8.0,18.0],"diameter_mm":[2.0,7.0],"kind":"SWEPT_CURVE_MESH","material":"RUBBER_MATTE","safe_overlap":[0.2,0.75]},"variant_id":"cable_rubber"},{"decision":"ABSTAIN","family":"CABLE","geometry":{"depth_offset_mm":[-8.0,18.0],"diameter_mm":[2.0,7.0],"kind":"SWEPT_CURVE_MESH","material":"POLYMER_TRANSLUCENT","opacity":[0.45,0.8],"safe_overlap":[0.2,0.75]},"variant_id":"cable_translucent"},{"decision":"ABSTAIN","family":"TOOL","geometry":{"depth_offset_mm":[-12.0,20.0],"kind":"BEVELED_TOOL_MESH","material":"METAL_MATTE","placement":"EDGE","safe_overlap":[0.25,0.5]},"variant_id":"tool_matte_edge"},{"decision":"ABSTAIN","family":"TOOL","geometry":{"depth_offset_mm":[-12.0,20.0],"kind":"BEVELED_TOOL_MESH","material":"METAL_GLOSS","placement":"CENTER","safe_overlap":[0.5,0.8]},"variant_id":"tool_gloss_center"},{"decision":"ABSTAIN","family":"FOREIGN_OBJECT","geometry":{"depth_offset_mm":[-10.0,22.0],"kind":"ROUNDED_SOLID_MESH","material_set":["PLASTIC_MATTE","FABRIC","METAL_GLOSS"],"safe_overlap":[0.35,0.7]},"variant_id":"foreign_object"},{"decision":"ABSTAIN","family":"IMAGE_QUALITY","geometry":{"kind":"AREA_LIGHT_REFLECTION","roughness":[0.05,0.35],"safe_overlap":[0.3,0.8]},"variant_id":"glare"},{"decision":"ABSTAIN","family":"IMAGE_QUALITY","geometry":{"focus_error_mm":[12.0,35.0],"kind":"CAMERA_DEFOCUS"},"variant_id":"defocus"},{"decision":"ABSTAIN","family":"IMAGE_QUALITY","geometry":{"kind":"EXPOSURE_MOTION","pixel_extent":[7.0,15.0]},"variant_id":"motion_blur"},{"decision":"ABSTAIN","family":"IMAGE_QUALITY","geometry":{"kind":"ENCODE_ROUNDTRIP","quality":[18,42]},"variant_id":"compression"}]}
